{
  "$schema": "http://json-schema.org/draft-04/schema#",
  "type": "object",
  "properties": {
    "id": {
      "type": "integer"
    },
    "name": {
      "type": "string"
    },
    "returns": {
      "type": "string"
    },
    "params": {
      "type": "array",
      "items": {
        "type": "object",
        "properties": {
          "name": {
            "type": "string"
          },
          "type": {
            "type": "string"
          },
          "description": {
            "type": "string"
          }
        },
        "required": [
          "name",
          "type",
          "description"
        ]
      }
    },
    "brief": {
      "type": "string"
    },
    "class": {
      "type": "string"
    },
    "firmwares": {
      "type": "array",
      "items": {
        "type": "string"
      },
      "minItems": 1,
      "uniqueItems": true
    },
    "flags": {
      "type": "array",
      "items": {
        "type": "string"
      },
      "minItems": 0,
      "uniqueItems": true
    }
  },
  "required": [
    "id",
    "name",
    "returns",
    "params",
    "brief",
    "class",
    "firmwares",
    "flags"
  ]
}