{
  "name": "sys_process_get_sdk_version",
  "id": 25,
  "returns": "int",
  "brief": "Returns the SDK version of a process",
  "class": "sys_process",
  "params": [
    {
      "name": "pid",
      "type": "sys_pid_t",
      "description": "The PID of the process you want to get the SDK Version of"
    },
    {
      "name": "version",
      "type": "u32*",
      "description": "The pointer to the u32 which the SDK Version will be written to"
    }
  ],
  "flags": [
    "root"
  ],
  "firmwares": [
    "CEX",
    "DEX",
    "DECR"
  ]
}
