{
  "name": "sys_fs_open",
  "id": 801,
  "returns": "CellFsErrno",
  "brief": "Opens a file",
  "class": "sys_fs",
  "params": [
    {
      "name": "path",
      "type": "const char*",
      "description": "The path of the file to open"
    },
    {
      "name": "flags",
      "type": "u32",
      "description": "The flags to open the file with"
    },
    {
      "name": "fd",
      "type": "u32*",
      "description": "The variable to write the resultant file descriptor to"
    },
    {
      "name": "arg",
      "type": "const void*",
      "description": "Miscellaneous arguments"
    },
    {
      "name": "size",
      "type": "u64",
      "description": "Length of the miscellaneous arguments"
    }
  ],
  "flags": [],
  "firmwares": [
    "CEX",
    "DEX",
    "DECR"
  ]
}