{
  "name": "sys_fs_unlink",
  "id": 814,
  "returns": "CellFsErrno",
  "brief": "Deletes a file",
  "class": "sys_fs",
  "params": [
    {
      "name": "path",
      "type": "const char*",
      "description": "The path of the file to delete"
    }
  ],
  "flags": [],
  "firmwares": [
    "CEX",
    "DEX",
    "DECR"
  ]
}